question,answer,metadata
"if a loan is in the name of a legal entity, can the shareholder or director get a loan? (example 44)"," if you meet the bank's requirements, yes. this example is created for demonstration purposes.",general
who can use it? (example 6), the qr reading feature is added as a new additional feature to the xacbank app. every customer who is registered with the internet banking service and has xacbank installed on their mobile (smart) phone can use this feature. this example is created for demonstration purposes.,general
can loan repayments be exempted for a certain period of time? (example 66)," depending on the seasonal characteristics of the business and the frequency of income, principal payments may be exempted. only interest payments will be made during the months when principal payments are exempted.  this example is created for demonstration purposes.",general
can i use property collateral as a down payment? (example 33), yes /except cars with vehicle registration plates of mongolia/ this example is created for demonstration purposes.,general
"if a loan is in the name of a legal entity, can the shareholder or director get a loan? (example 31)"," if you meet the bank's requirements, yes. this example is created for demonstration purposes.",general
"if a loan is in the name of a legal entity, can the shareholder or director get a loan? (example 93)"," if you meet the bank's requirements, yes. this example is created for demonstration purposes.",general
9. how to increase your transaction limit through digital banking? (example 41), for individual customers: change the limit through the settings menu of the digital bank.  for legal entities: fill out the internet bank information change request form and contact any branch of the bank with an official letter. this example is created for demonstration purposes.,general
who can use the service? (example 13), the qr scanning service is an additional function of the xacbank smartphone application. customers who have already registered for xacbank’s internet banking service can use qr scanning once the xacbank application has been installed on their smartphone. this example is created for demonstration purposes.,general
what are the criteria to receive the “supplier loan” service? (example 4)," be a supplier of oyu tolgoi llc; have a valid contract; receive payment for the goods and services supplied to the khasbank account; if a special license is required to conduct the business activity, the license must be obtained from the authorized body;  this example is created for demonstration purposes.",general
7. how to change your password? (example 11)," if you change your login or transaction password, you can change your password by selecting the change password submenu from the settings menu of digital bank. this example is created for demonstration purposes.",general
can i use property collateral as a down payment? (example 16), yes /except cars with vehicle registration plates of mongolia/ this example is created for demonstration purposes.,general
is it possible to get a business loan if you have a loan from another bank? (example 55), yes. a decision will be made on whether to grant a loan based on the loan information of other banks and your business loan research. this example is created for demonstration purposes.,general
"if sales income is transferred through a bank account other than xasbank, will a loan be granted? (example 56)", granted. income will be confirmed by the bank statement for the last 6 months of the bank account through which sales income is transferred.  this example is created for demonstration purposes.,general
is it mandatory to provide the bank with updated financial information during the loan period? (example 76), the loan agreement stipulates that the bank must provide all the information requested by it.  supplier loan this example is created for demonstration purposes.,general
"if sales income is transferred through a bank account other than xasbank, will a loan be granted? (example 3)", granted. income will be confirmed by the bank statement for the last 6 months of the bank account through which sales income is transferred.  this example is created for demonstration purposes.,general
how to fill out the letter of credit application form? (example 8), click here to see instructions on how to fill out the letter of credit application form. this example is created for demonstration purposes.,general
when will customer of other banks receive my transferred money which i make through digital banking? (example 27)," if amount of the transfer is below 5.0 million mnt, money will be transferred on-time, the beneficiary will get the money same time of money sent. if the amount of the transfer is more than 5.0 million mnt, the transfer will process within 2 hours on weekdays.  if during weekend, transaction will complete next working days. this example is created for demonstration purposes.",general
can i take out a working capital loan and a fixed asset loan at the same time? (example 79)," yes. depending on the amount of collateral, business income can be taken at the same time. this example is created for demonstration purposes.",general
does the pledgor have to come and sign the collateral agreement in person? (example 11), yes. the consent of the co-owner of the collateral on behalf of the minor child must be signed in the collateral agreement. this example is created for demonstration purposes.,general
do i need to use transaction code for every transactions? (example 76), transaction code is not requested when transferring between your accounts.   mobile bank 2.0 this example is created for demonstration purposes.,general
what can i do if i forgot my password? (example 6)," if you forgot or blocked pin code of your payment card, you can use our digital bank and select pin change function from the card menu, to renew your pin code. if you are not registered in our digital bank, please click here to register.  click here to see video tutorial of changing pin code. this example is created for demonstration purposes.",general
"if sales income is transferred through a bank account other than xasbank, will a loan be granted? (example 54)", granted. income will be confirmed by the bank statement for the last 6 months of the bank account through which sales income is transferred.  this example is created for demonstration purposes.,general
does the pledgor have to come and sign the collateral agreement in person? (example 65), yes. the consent of the co-owner of the collateral on behalf of the minor child must be signed in the collateral agreement. this example is created for demonstration purposes.,general
what is the eligibility of salary loan? (example 46)," you can get salary loan if you have worked for a legal entity for at least 6 months, not in trial period, and working for a company that have cooperation agreement with xacbank. you are eligible if you changed your job without trail period.   миат credit card this example is created for demonstration purposes.",general
how can i register for the service? (example 59), customers can access the service using xacbank’s internet banking application. the application can be downloaded to any android or iphone smartphone via the app store. this example is created for demonstration purposes.,general
how to redeem your miles? (example 78), please click here to how to redeem your miles.  хасинфо this example is created for demonstration purposes.,general
who is a co-borrower? (example 71), a co-borrower is a person who has the same rights and obligations as the borrower in a loan agreement. this example is created for demonstration purposes.,general
"how to use it, that is, how to make a payment? (example 9)"," every customer who can make a payment by scanning qr codes will scan a payment invoice or sign containing a qr code and then proceed with the transaction after reviewing the detailed breakdown that appears. fees to be paid by the customer when paying using qr:  the transaction is considered an internet banking transaction.  if a hasbank customer makes a transaction to a merchant created by hasbank or created by someone else who has an account with hasbank, there is no transaction fee.  if a hasbank customer makes a transaction to a customer created by another bank or who has selected their account as a merchant account, an interbank transaction fee will be charged.  frequently asked questions and answers about business loans this example is created for demonstration purposes.",general
how much money can i withdraw from atm? (example 72)," one-time bills for atms in mongolia are limited to 40.  but internationally, one-time transaction limit is different for depends on banks. this example is created for demonstration purposes.",general
7. how to change your password? (example 19)," if you change your login or transaction password, you can change your password by selecting the change password submenu from the settings menu of digital bank. this example is created for demonstration purposes.",general
does the pledgor have to come and sign the collateral agreement in person? (example 77), yes. the consent of the co-owner of the collateral on behalf of the minor child must be signed in the collateral agreement. this example is created for demonstration purposes.,general
what collateral is required for a business loan? (example 62)," real estate, movable property, and current assets are pledged.  this example is created for demonstration purposes.",general
can citizens and legal entities who have never taken a loan before get a loan? (example 81)," yes. if you meet the loan criteria, a decision will be made on whether to grant a loan based on the review. this example is created for demonstration purposes.",general
11. is it possible to make transactions without using a transaction password? (example 49)," for transactions between your own accounts only, the customer does not need a transaction password.  import letter of credit this example is created for demonstration purposes.",general
what is credit card? (example 71), credit card is one type of payment card and designed for non-cash transactions. cash repayment rates are higher than non-cash transactions. this example is created for demonstration purposes.,general
what are the criteria to receive the “supplier loan” service? (example 11)," be a supplier of oyu tolgoi llc; have a valid contract; receive payment for the goods and services supplied to the khasbank account; if a special license is required to conduct the business activity, the license must be obtained from the authorized body;  this example is created for demonstration purposes.",general
2. what types of services can be obtained through digital banking? (example 50)," you can receive all services except cash transfers to the bank and cash withdrawals from the account. these include:  accounts: opening new term and demand deposits and current accounts; obtaining information on term and demand deposits, current and loan accounts, checking balances, obtaining statements and account statements, etc.; non-cash payments: transferring funds between khasbank accounts without costs; making interbank transactions; paying bills using the qpay service; paying loan payments; paying utility bills; paying government services, taxes and customs duties; paying credit card payments; international money transfers (swift); saving regular transactions as templates; transferring different amounts and transaction values ​​to up to five accounts at the same time multi-transactions; making transactions using the recipient's phone number and email address; making high-value currency trading transactions; creating custom transactions; get transaction receipts; cards: view debit and credit card information; create and cancel new card orders; order a virtual card that can be used immediately after ordering; change card status; temporarily deactivate, reopen, reorder, and mail your lost or stolen card; get your card pin; get an e-pin for online transactions; open and close international transactions; increase or decrease your card transaction limit; loans: new and renewed loans secured by deposits, and extend their terms; get a salary loan; view loan balance and credit rights information; pay and close loans; others: use the mobile cash service to withdraw cash from your nearest xasbank atm when you don't have a card; calculate exchange rates, deposits, and loans; view the location of your nearest branches and atms in a list or on a map; change and update your personal information; account management; change your password;  this example is created for demonstration purposes.",general
1. how to register for digital banking services? (example 80)," to download the xacbank digital app or log in via the web, click https://digital.xacbank.mn/xacbaseapp/; please bring your citizen's electronic id card to any xacbank branch or unit near you.  the legal entity that is the customer:  write an official letter about registering for the service, fill out the xacbank form, and visit the nearest branch.  this example is created for demonstration purposes.",general
how much money can i withdraw from atm? (example 39)," one-time bills for atms in mongolia are limited to 40.  but internationally, one-time transaction limit is different for depends on banks. this example is created for demonstration purposes.",general
what documents are required? (example 63), company profile and application; management shareholder profile and copy of id card; invoice certified by oyu tolgoi llc; supply agreement with oyu tolgoi llc; license required to conduct the business activity / if a special license is required /; others.  this example is created for demonstration purposes.,general
does the pledgor have to come and sign the collateral agreement in person? (example 43), yes. the consent of the co-owner of the collateral on behalf of the minor child must be signed in the collateral agreement. this example is created for demonstration purposes.,general
is it mandatory to insure collateral? (example 52), assets financed by loans must be insured.  this example is created for demonstration purposes.,general
how can i digital banking? (example 60), download xacbank digital app or visit https://digital.xacbank.mn/xacbaseapp/ from website. contact the nearest branch with your id card;  legal entity:  visit the nearest xacbank branch.  this example is created for demonstration purposes.,general
is it mandatory to visit the site for a loan investigation? (example 19), yes. a loan officer will visit your business on site and conduct a survey.  this example is created for demonstration purposes.,general
who can i get more detailed information about external guarantees from? (example 30), you can visit your nearest xacbank branch to get more detailed information quickly.  digital banking this example is created for demonstration purposes.,general
8. how to add or remove accounts from digital bank services? (example 53), for individual customers:  you can add or remove accounts using the account management menu in the settings menu of the internet bank.  for legal entities: fill out the internet bank information change request form and contact any branch of the bank with an official letter. this example is created for demonstration purposes.,general
what to do when lost/stolen you card? (example 56)," please call the customer service center at 1800-1888. the card will be temporarily closed, you will have to open the card and request the card at the nearest xacbank branch and settlement center if you find your card if you want to order a new card, please go to your branch to order a new card. lost/stolen card is not reported to bank immediately, any unrecognized transactions would be cardholder's responsobility. this example is created for demonstration purposes.",general
how to get a billing invoice? (example 32), the bank will notify you via your registred e-mail or text message to your mobile phone number (as per credit card terms). you are able to also check in credit card section in internet banking. this example is created for demonstration purposes.,general
10. how long does it take for a bank-to-bank transaction to be credited to the recipient's account? (example 14)," interbank transactions under 5 million tugriks made through digital banking will be transferred immediately, and transactions over 5 million tugriks will be transferred within 2 hours on business days.  if it is a weekend, it will be transferred to the next business day. this example is created for demonstration purposes.",general
what collateral is required for a business loan? (example 76)," real estate, movable property, and current assets are pledged.  this example is created for demonstration purposes.",general
how to redeem your miles? (example 98), please click here to how to redeem your miles.  хасинфо this example is created for demonstration purposes.,general
2. what types of services can be obtained through digital banking? (example 75)," you can receive all services except cash transfers to the bank and cash withdrawals from the account. these include:  accounts: opening new term and demand deposits and current accounts; obtaining information on term and demand deposits, current and loan accounts, checking balances, obtaining statements and account statements, etc.; non-cash payments: transferring funds between khasbank accounts without costs; making interbank transactions; paying bills using the qpay service; paying loan payments; paying utility bills; paying government services, taxes and customs duties; paying credit card payments; international money transfers (swift); saving regular transactions as templates; transferring different amounts and transaction values ​​to up to five accounts at the same time multi-transactions; making transactions using the recipient's phone number and email address; making high-value currency trading transactions; creating custom transactions; get transaction receipts; cards: view debit and credit card information; create and cancel new card orders; order a virtual card that can be used immediately after ordering; change card status; temporarily deactivate, reopen, reorder, and mail your lost or stolen card; get your card pin; get an e-pin for online transactions; open and close international transactions; increase or decrease your card transaction limit; loans: new and renewed loans secured by deposits, and extend their terms; get a salary loan; view loan balance and credit rights information; pay and close loans; others: use the mobile cash service to withdraw cash from your nearest xasbank atm when you don't have a card; calculate exchange rates, deposits, and loans; view the location of your nearest branches and atms in a list or on a map; change and update your personal information; account management; change your password;  this example is created for demonstration purposes.",general
"how to use it, that is, how to make a payment? (example 12)"," every customer who can make a payment by scanning qr codes will scan a payment invoice or sign containing a qr code and then proceed with the transaction after reviewing the detailed breakdown that appears. fees to be paid by the customer when paying using qr:  the transaction is considered an internet banking transaction.  if a hasbank customer makes a transaction to a merchant created by hasbank or created by someone else who has an account with hasbank, there is no transaction fee.  if a hasbank customer makes a transaction to a customer created by another bank or who has selected their account as a merchant account, an interbank transaction fee will be charged.  frequently asked questions and answers about business loans this example is created for demonstration purposes.",general
how can i register for the service? (example 33), customers can access the service using xacbank’s internet banking application. the application can be downloaded to any android or iphone smartphone via the app store. this example is created for demonstration purposes.,general
will the collateral be seized if the loan term expires? (example 27)," if, as a result of taking measures related to loan repayment, it is deemed necessary to secure the loan with collateral, the decision will be made in accordance with the decision of the department of credit and debt collection. this example is created for demonstration purposes.",general
how do i add or remove accounts to/from my internet banking? (example 55)," for individual user:  please go to settings - account settings, and check the account(s) that you want to add to the internet banking and click ""add account"" button. the function is available from xacbank mobile application also.  for legal entity’s user:  you can add account(s) to internet banking by submitting a letter of request and fill a request form. for removing account(s), you can use settings - account settings and check the account(s) that you want to remove and click ""remove account"" button. this example is created for demonstration purposes.",general
how much money can i withdraw from atm? (example 70)," one-time bills for atms in mongolia are limited to 40.  but internationally, one-time transaction limit is different for depends on banks. this example is created for demonstration purposes.",general
does the pledgor have to come and sign the collateral agreement in person? (example 8), yes. the consent of the co-owner of the collateral on behalf of the minor child must be signed in the collateral agreement. this example is created for demonstration purposes.,general
what is the eligibility of salary loan? (example 56)," you can get salary loan if you have worked for a legal entity for at least 6 months, not in trial period, and working for a company that have cooperation agreement with xacbank. you are eligible if you changed your job without trail period.  salary loan this example is created for demonstration purposes.",general
what documents are required to open an import letter of credit? (example 9), if you deposit money into your account or open it with a source:  request for opening a letter of credit click here to download;  trade agreement or equivalent document.  if you open without a source:  request for opening a letter of credit click here to download;  trade agreement or equivalent document;  list of documents to be submitted by the bank borrower.  this example is created for demonstration purposes.,general
7. how to change your password? (example 51)," if you change your login or transaction password, you can change your password by selecting the change password submenu from the settings menu of digital bank. this example is created for demonstration purposes.",general
5. what if i forgot my transaction password? (example 22)," enter the transaction (interbank transaction or intrabank) as if you are going to make a transaction (interbank transaction or intrabank transaction), click on the ""forgot transaction password"" link under the transaction password window and enter your new transaction password. this example is created for demonstration purposes.",general
do i need to use transaction code for every transactions? (example 21), transaction code is not requested when transferring between your accounts.   mobile bank 2.0 this example is created for demonstration purposes.,general
how can i update my transaction limit? (example 28), for individual user:  please go to settings - manage limit section.   for legal entity’s user: legal entity can change its transaction limit by submitting a letter of request to the branch. this example is created for demonstration purposes.,general
3. can i use digital banking services from my mobile phone? (example 36)," yes, you can install and use our internet banking application on your android or ios mobile phone.  this example is created for demonstration purposes.",general
what to do if i forgot my login password? (example 97)," click on button “forgot password” just below “login window” and enter your credentials. once you’ve done, otp will be sent to your mobile phone. using the otp you can create/update the password.  note: your password must be at least 8 characters containing a combination of at least three of the following characters: uppercase letters, lowercase letters, numbers or symbols. for instance, james2, james@, jamesa2 etc. this example is created for demonstration purposes.",general
please explain the process of obtaining the “supplier loan” service? (example 25), you will deliver goods or provide services to oyu tolgoi llc in accordance with the order; you will receive confirmation of your invoice from oyu tolgoi llc: you will submit a supplier credit request to xasbank and prepare the relevant documents; xasbank will conclude a relevant contract with the supplier and provide financing in accordance with the contract.  external guarantee this example is created for demonstration purposes.,general
how to unlock my pin code? (example 53), after 5 wrong tries your mobile bank account will be locked. in order to unlock your account you have to visit the nearest branch or call 1800-1888 from registered phone number and request for new pin code. than dial *1888# number and enter new pin code this example is created for demonstration purposes.,general
8. how to add or remove accounts from digital bank services? (example 85), for individual customers:  you can add or remove accounts using the account management menu in the settings menu of the internet bank.  for legal entities: fill out the internet bank information change request form and contact any branch of the bank with an official letter. this example is created for demonstration purposes.,general
