question,answer,metadata
9. how to increase your transaction limit through digital banking? (example 37), for individual customers: change the limit through the settings menu of the digital bank.  for legal entities: fill out the internet bank information change request form and contact any branch of the bank with an official letter. this example is created for demonstration purposes.,general
6. what if i forgot my digital bank login name? (example 24)," click on the ""forgot username"" link under the ""login window"". enter the one-time password sent to the registered phone number and get your login name. you can call the customer service center at 1800-1888 or visit any branch in person.  this example is created for demonstration purposes.",general
3. can i use digital banking services from my mobile phone? (example 39)," yes, you can install and use our internet banking application on your android or ios mobile phone.  this example is created for demonstration purposes.",general
can i make amendments to an opened export letter of credit? (example 49)," to make amendments to an export letter of credit, you must submit an amendment to the letter of credit with the issuing bank in agreement with the importer. if you need assistance in making amendments, xasbank will contact the issuing bank to help you resolve your issue  this example is created for demonstration purposes.",general
how to get a billing invoice? (example 100), the bank will notify you via your registred e-mail or text message to your mobile phone number (as per credit card terms). you are able to also check in credit card section in internet banking. this example is created for demonstration purposes.,general
can i use property collateral as a down payment? (example 70), yes /except cars with vehicle registration plates of mongolia/ this example is created for demonstration purposes.,general
can loan repayments be exempted for a certain period of time? (example 43)," depending on the seasonal characteristics of the business and the frequency of income, principal payments may be exempted. only interest payments will be made during the months when principal payments are exempted.  this example is created for demonstration purposes.",general
what is credit card? (example 23), credit card is one type of payment card and designed for non-cash transactions. cash repayment rates are higher than non-cash transactions. this example is created for demonstration purposes.,general
"if sales income is transferred through a bank account other than xasbank, will a loan be granted? (example 65)", granted. income will be confirmed by the bank statement for the last 6 months of the bank account through which sales income is transferred.  this example is created for demonstration purposes.,general
can i take out a collateral at more than 2 loans? (example 80), only more than 2 loans of xasbank can be taken at the same time. the bank takes out collateral with the right to claim it first. this example is created for demonstration purposes.,general
what is ‘qpay service’? (example 71)," it is a service that allows xacbank internet banking customers to pay by scanning qr /qu-ar/ codes using the “xacbank” application for smartphones, create qr codes for their accounts, or create invoices and receive income to their accounts. this example is created for demonstration purposes.",general
can i get a project loan if i have a business loan? (example 35), if you meet the additional project loan criteria. you must notify the bank in advance. this example is created for demonstration purposes.,general
can i use mobile bank 2.0 while in abroad? (example 39), yes. you can use mobile bank 2.0 service enabling message roaming service.   qpay service this example is created for demonstration purposes.,general
how much is the daily transaction limit? (example 18)," the daily transaction limit for each card is different.  card type   maximum cash spending per day   maximum purchase transaction visa fifa world cup qatar 2022 themed official card 10,000,000 mnt 10,000,000 mnt  ₮ and unionpay dual brand card   5,000,000 mnt   5,000,000 mnt  visa card   5,000,000 mnt   5,000,000 mnt  platinum card (visa, upi)   20,000,000 mnt   20,000,000 mnt  temuulel card   250,000 mnt   1,000,000 mnt  credit card   30% of credit card limit   credit card limit  this example is created for demonstration purposes.",general
who can use the service? (example 70), the qr scanning service is an additional function of the xacbank smartphone application. customers who have already registered for xacbank’s internet banking service can use qr scanning once the xacbank application has been installed on their smartphone. this example is created for demonstration purposes.,general
will the collateral be seized if the loan term expires? (example 46)," if, as a result of taking measures related to loan repayment, it is deemed necessary to secure the loan with collateral, the decision will be made in accordance with the decision of the department of credit and debt collection. this example is created for demonstration purposes.",general
how to pay credit card payment? (example 50)," according to monthly statement, all payment or mandatory payment should be paid before due date. payment can be paid by:  using internet banking and mobile banking; visit the nearest branches; or use cash recycling machine.  this example is created for demonstration purposes.",general
what are the fees related to qpay transfer? (example 94)," transaction fees for using qpay are the same as internet banking transaction fees, as follows:  the service will have zero fee if the transaction or payment is between xacbank accounts. the service will be charged an interbank transaction fee, if the transaction or payment is made to another bank via scanning that bank’s qr sign.  salary loan this example is created for demonstration purposes.",general
what are the criteria to receive the “supplier loan” service? (example 86)," be a supplier of oyu tolgoi llc; have a valid contract; receive payment for the goods and services supplied to the khasbank account; if a special license is required to conduct the business activity, the license must be obtained from the authorized body;  this example is created for demonstration purposes.",general
9. how to increase your transaction limit through digital banking? (example 82), for individual customers: change the limit through the settings menu of the digital bank.  for legal entities: fill out the internet bank information change request form and contact any branch of the bank with an official letter. this example is created for demonstration purposes.,general
when will customer of other banks receive my transferred money which i make through digital banking? (example 53)," if amount of the transfer is below 5.0 million mnt, money will be transferred on-time, the beneficiary will get the money same time of money sent. if the amount of the transfer is more than 5.0 million mnt, the transfer will process within 2 hours on weekdays.  if during weekend, transaction will complete next working days. this example is created for demonstration purposes.",general
what documents are required as proof of income for a business loan? (example 8)," for individuals, a bank statement showing business income for the last 6 months. for legal entities, a report certified by the tax office. this example is created for demonstration purposes.",general
can you do transactions between banks using mobile banking? (example 81)," you can transfer money between banks using xacbank mobile banking service.  transfer within xacbank - 100mnt,  interbank transfers - 300mnt. this example is created for demonstration purposes.",general
is it mandatory to provide the bank with updated financial information during the loan period? (example 60), the loan agreement stipulates that the bank must provide all the information requested by it.  supplier loan this example is created for demonstration purposes.,general
please explain the process of obtaining the “receivables financing” service? (example 21), you will deliver the goods or services in accordance with the order to oyu tolgoi llc; you will receive the invoice from oyu tolgoi llc: you will submit a supplier credit request to xasbank and prepare the relevant documents; xasbank will conclude a relevant agreement with the supplier and provide financing in accordance with the agreement.  export letter of credit this example is created for demonstration purposes.,general
10. how long does it take for a bank-to-bank transaction to be credited to the recipient's account? (example 16)," interbank transactions under 5 million tugriks made through digital banking will be transferred immediately, and transactions over 5 million tugriks will be transferred within 2 hours on business days.  if it is a weekend, it will be transferred to the next business day. this example is created for demonstration purposes.",general
2. what types of services can be obtained through digital banking? (example 49)," you can receive all services except cash transfers to the bank and cash withdrawals from the account. these include:  accounts: opening new term and demand deposits and current accounts; obtaining information on term and demand deposits, current and loan accounts, checking balances, obtaining statements and account statements, etc.; non-cash payments: transferring funds between khasbank accounts without costs; making interbank transactions; paying bills using the qpay service; paying loan payments; paying utility bills; paying government services, taxes and customs duties; paying credit card payments; international money transfers (swift); saving regular transactions as templates; transferring different amounts and transaction values ​​to up to five accounts at the same time multi-transactions; making transactions using the recipient's phone number and email address; making high-value currency trading transactions; creating custom transactions; get transaction receipts; cards: view debit and credit card information; create and cancel new card orders; order a virtual card that can be used immediately after ordering; change card status; temporarily deactivate, reopen, reorder, and mail your lost or stolen card; get your card pin; get an e-pin for online transactions; open and close international transactions; increase or decrease your card transaction limit; loans: new and renewed loans secured by deposits, and extend their terms; get a salary loan; view loan balance and credit rights information; pay and close loans; others: use the mobile cash service to withdraw cash from your nearest xasbank atm when you don't have a card; calculate exchange rates, deposits, and loans; view the location of your nearest branches and atms in a list or on a map; change and update your personal information; account management; change your password;  this example is created for demonstration purposes.",general
when will customer of other banks receive my transferred money which i make through digital banking? (example 64)," if amount of the transfer is below 5.0 million mnt, money will be transferred on-time, the beneficiary will get the money same time of money sent. if the amount of the transfer is more than 5.0 million mnt, the transfer will process within 2 hours on weekdays.  if during weekend, transaction will complete next working days. this example is created for demonstration purposes.",general
‘what is qpay service? (example 92), a service that eases customer transactions through unique qr codes for each customer. customers are able to make and receive payments through use of the qr codes on the xacbank internet banking application. this example is created for demonstration purposes.,general
can you do transactions between banks using mobile banking? (example 77)," you can transfer money between banks using xacbank mobile banking service.  transfer within xacbank - 100mnt,  interbank transfers - 300mnt. this example is created for demonstration purposes.",general
what to do when lost/stolen you card? (example 78)," please call the customer service center at 1800-1888. the card will be temporarily closed, you will have to open the card and request the card at the nearest xacbank branch and settlement center if you find your card if you want to order a new card, please go to your branch to order a new card. lost/stolen card is not reported to bank immediately, any unrecognized transactions would be cardholder's responsobility. this example is created for demonstration purposes.",general
is it possible to get a business loan if you have a loan from another bank? (example 51), yes. a decision will be made on whether to grant a loan based on the loan information of other banks and your business loan research. this example is created for demonstration purposes.,general
how to redeem your miles? (example 2), please click here to how to redeem your miles.  хасинфо this example is created for demonstration purposes.,general
11. is it possible to make transactions without using a transaction password? (example 68)," for transactions between your own accounts only, the customer does not need a transaction password.  import letter of credit this example is created for demonstration purposes.",general
which countries in the world can hasbank issue import letters of credit? (example 12), hasbank will issue an import letter of credit to any country in the world where your customer is located. this example is created for demonstration purposes.,general
"if sales income is transferred through a bank account other than xasbank, will a loan be granted? (example 37)", granted. income will be confirmed by the bank statement for the last 6 months of the bank account through which sales income is transferred.  this example is created for demonstration purposes.,general
can you do transactions between banks using mobile banking? (example 67)," you can transfer money between banks using xacbank mobile banking service.  transfer within xacbank - 100mnt,  interbank transfers - 300mnt. this example is created for demonstration purposes.",general
8. how to add or remove accounts from digital bank services? (example 87), for individual customers:  you can add or remove accounts using the account management menu in the settings menu of the internet bank.  for legal entities: fill out the internet bank information change request form and contact any branch of the bank with an official letter. this example is created for demonstration purposes.,general
how much is commission fee of deposit backed loan? (example 85), there is no commission fee if you revolving amount within your loan limit. you should only pay the commission fee of 0.5% if you lengthen your tenor or increase your limit.   digital banking this example is created for demonstration purposes.,general
3. can i use digital banking services from my mobile phone? (example 54)," yes, you can install and use our internet banking application on your android or ios mobile phone.  this example is created for demonstration purposes.",general
what documents are required to open an external guarantee? (example 85)," guarantee with a source:  request for a guarantee; relevant documents such as a performance contract or a cooperation agreement, depending on the type of guarantee.  unsourced guarantee:  request for a guarantee; relevant documents such as a performance contract or a cooperation agreement, depending on the type of guarantee; relevant documents for a bank loan.  this example is created for demonstration purposes.",general
‘what is qpay service? (example 89), a service that eases customer transactions through unique qr codes for each customer. customers are able to make and receive payments through use of the qr codes on the xacbank internet banking application. this example is created for demonstration purposes.,general
‘what is qpay service? (example 15), a service that eases customer transactions through unique qr codes for each customer. customers are able to make and receive payments through use of the qr codes on the xacbank internet banking application. this example is created for demonstration purposes.,general
is it mandatory to visit the site for a loan investigation? (example 24), yes. a loan officer will visit your business on site and conduct a survey.  this example is created for demonstration purposes.,general
what documents are required to open an import letter of credit? (example 85), if you deposit money into your account or open it with a source:  request for opening a letter of credit click here to download;  trade agreement or equivalent document.  if you open without a source:  request for opening a letter of credit click here to download;  trade agreement or equivalent document;  list of documents to be submitted by the bank borrower.  this example is created for demonstration purposes.,general
please explain the process of obtaining the “supplier loan” service? (example 66), you will deliver goods or provide services to oyu tolgoi llc in accordance with the order; you will receive confirmation of your invoice from oyu tolgoi llc: you will submit a supplier credit request to xasbank and prepare the relevant documents; xasbank will conclude a relevant contract with the supplier and provide financing in accordance with the contract.  external guarantee this example is created for demonstration purposes.,general
what collateral is required for a business loan? (example 21)," real estate, movable property, and current assets are pledged.  this example is created for demonstration purposes.",general
when will customer of other banks receive my transferred money which i make through digital banking? (example 32)," if amount of the transfer is below 5.0 million mnt, money will be transferred on-time, the beneficiary will get the money same time of money sent. if the amount of the transfer is more than 5.0 million mnt, the transfer will process within 2 hours on weekdays.  if during weekend, transaction will complete next working days. this example is created for demonstration purposes.",general
what to do if i forgot my login password? (example 24)," click on button “forgot password” just below “login window” and enter your credentials. once you’ve done, otp will be sent to your mobile phone. using the otp you can create/update the password.  note: your password must be at least 8 characters containing a combination of at least three of the following characters: uppercase letters, lowercase letters, numbers or symbols. for instance, james2, james@, jamesa2 etc. this example is created for demonstration purposes.",general
who can i get more detailed information about external guarantees from? (example 88), you can visit your nearest xacbank branch to get more detailed information quickly.  digital banking this example is created for demonstration purposes.,general
what are the fees related to qpay transfer? (example 5)," transaction fees for using qpay are the same as internet banking transaction fees, as follows:  the service will have zero fee if the transaction or payment is between xacbank accounts. the service will be charged an interbank transaction fee, if the transaction or payment is made to another bank via scanning that bank’s qr sign.  salary loan this example is created for demonstration purposes.",general
please explain the process of obtaining the “receivables financing” service? (example 23), you will deliver the goods or services in accordance with the order to oyu tolgoi llc; you will receive the invoice from oyu tolgoi llc: you will submit a supplier credit request to xasbank and prepare the relevant documents; xasbank will conclude a relevant agreement with the supplier and provide financing in accordance with the agreement.  export letter of credit this example is created for demonstration purposes.,general
to which countries in the world can xasbank issue guarantees? (example 68), xasbank will issue guarantees to any country in the world where your client is located.  this example is created for demonstration purposes.,general
is it possible to get a business loan if you have a loan from another bank? (example 99), yes. a decision will be made on whether to grant a loan based on the loan information of other banks and your business loan research. this example is created for demonstration purposes.,general
what is included in movable assets? (example 4)," machinery, technical equipment, and equipment that are in normal operation.  this example is created for demonstration purposes.",general
does the pledgor have to come and sign the collateral agreement in person? (example 74), yes. the consent of the co-owner of the collateral on behalf of the minor child must be signed in the collateral agreement. this example is created for demonstration purposes.,general
can i get a business loan if i have a project loan? (example 67), if you meet the bank's criteria. this example is created for demonstration purposes.,general
what are the criteria to receive the “supplier loan” service? (example 77)," be a supplier of oyu tolgoi llc; have a valid contract; receive payment for the goods and services supplied to the khasbank account; if a special license is required to conduct the business activity, the license must be obtained from the authorized body;  this example is created for demonstration purposes.",general
how much is commission fee of deposit backed loan? (example 10), there is no commission fee if you revolving amount within your loan limit. you should only pay the commission fee of 0.5% if you lengthen your tenor or increase your limit.   digital banking this example is created for demonstration purposes.,general
what are the criteria to receive the “supplier loan” service? (example 83)," be a supplier of oyu tolgoi llc; have a valid contract; receive payment for the goods and services supplied to the khasbank account; if a special license is required to conduct the business activity, the license must be obtained from the authorized body;  this example is created for demonstration purposes.",general
4. what if i forgot my login password? (example 58)," click on the “forgot password” link under the “login window”. enter the one-time password sent to your registered phone number and create a new password.  note: your password must be more than 8 digits long and contain any combination of uppercase and lowercase letters, numbers or symbols /ab2, ab@, a1@/. for example: naraa2, naraa@, naraaa2, etc. this example is created for demonstration purposes.",general
what can i do if i forgot my password? (example 97)," if you forgot or blocked pin code of your payment card, you can use our digital bank and select pin change function from the card menu, to renew your pin code. if you are not registered in our digital bank, please click here to register.  click here to see video tutorial of changing pin code. this example is created for demonstration purposes.",general
how can i update my transaction limit? (example 84), for individual user:  please go to settings - manage limit section.   for legal entity’s user: legal entity can change its transaction limit by submitting a letter of request to the branch. this example is created for demonstration purposes.,general
who can use it? (example 29), the qr reading feature is added as a new additional feature to the xacbank app. every customer who is registered with the internet banking service and has xacbank installed on their mobile (smart) phone can use this feature. this example is created for demonstration purposes.,general
what to do when lost/stolen you card? (example 96)," please call the customer service center at 1800-1888. the card will be temporarily closed, you will have to open the card and request the card at the nearest xacbank branch and settlement center if you find your card if you want to order a new card, please go to your branch to order a new card. lost/stolen card is not reported to bank immediately, any unrecognized transactions would be cardholder's responsobility. this example is created for demonstration purposes.",general
what are the criteria to be met in order to receive the “supplier loan” service? (example 23)," be a supplier of oyu tolgoi llc; have a valid contract; receive payment for the supplied goods and services into the account of xasbank; if a special license is required to conduct the business activity, the special license must be obtained from the authorized organization;  this example is created for demonstration purposes.",general
how can i digital banking? (example 38), download xacbank digital app or visit https://digital.xacbank.mn/xacbaseapp/ from website. contact the nearest branch with your id card;  legal entity:  visit the nearest xacbank branch.  this example is created for demonstration purposes.,general
