question,answer,metadata
can you do transactions between banks using mobile banking? (example 97)," you can transfer money between banks using xacbank mobile banking service.  transfer within xacbank - 100mnt,  interbank transfers - 300mnt. this example is created for demonstration purposes.",general
what is included in movable assets? (example 88)," machinery, technical equipment, and equipment that are in normal operation.  this example is created for demonstration purposes.",general
do i need to use transaction code for every transactions? (example 78), transaction code is not requested when transferring between your accounts.   mobile bank 2.0 this example is created for demonstration purposes.,general
2. what types of services can be obtained through digital banking? (example 1)," you can receive all services except cash transfers to the bank and cash withdrawals from the account. these include:  accounts: opening new term and demand deposits and current accounts; obtaining information on term and demand deposits, current and loan accounts, checking balances, obtaining statements and account statements, etc.; non-cash payments: transferring funds between khasbank accounts without costs; making interbank transactions; paying bills using the qpay service; paying loan payments; paying utility bills; paying government services, taxes and customs duties; paying credit card payments; international money transfers (swift); saving regular transactions as templates; transferring different amounts and transaction values ​​to up to five accounts at the same time multi-transactions; making transactions using the recipient's phone number and email address; making high-value currency trading transactions; creating custom transactions; get transaction receipts; cards: view debit and credit card information; create and cancel new card orders; order a virtual card that can be used immediately after ordering; change card status; temporarily deactivate, reopen, reorder, and mail your lost or stolen card; get your card pin; get an e-pin for online transactions; open and close international transactions; increase or decrease your card transaction limit; loans: new and renewed loans secured by deposits, and extend their terms; get a salary loan; view loan balance and credit rights information; pay and close loans; others: use the mobile cash service to withdraw cash from your nearest xasbank atm when you don't have a card; calculate exchange rates, deposits, and loans; view the location of your nearest branches and atms in a list or on a map; change and update your personal information; account management; change your password;  this example is created for demonstration purposes.",general
can loan repayments be exempted for a certain period of time? (example 42)," depending on the seasonal characteristics of the business and the frequency of income, principal payments may be exempted. only interest payments will be made during the months when principal payments are exempted.  this example is created for demonstration purposes.",general
is loan interest rate lowers if i pay higher down payment? (example 88), yes /except cars with vehicle registration plates of mongolia/.  card this example is created for demonstration purposes.,general
is it mandatory to provide the bank with updated financial information during the loan period? (example 12), the loan agreement stipulates that the bank must provide all the information requested by it.  supplier loan this example is created for demonstration purposes.,general
who is a co-borrower? (example 53), a co-borrower is a person who has the same rights and obligations as the borrower in a loan agreement. this example is created for demonstration purposes.,general
how much is commission fee of deposit backed loan? (example 94), there is no commission fee if you revolving amount within your loan limit. you should only pay the commission fee of 0.5% if you lengthen your tenor or increase your limit.   digital banking this example is created for demonstration purposes.,general
"how to a renew my pin code, if forgot? (example 76)"," you can renew your pin code visiting the nearest branch with your identification document. call 1800-1888 from your registered phone number, and make request to renew your pin code.  this example is created for demonstration purposes.",general
what is included in movable assets? (example 84)," machinery, technical equipment, and equipment that are in normal operation.  this example is created for demonstration purposes.",general
"how to use it, that is, how to make a payment? (example 45)"," every customer who can make a payment by scanning qr codes will scan a payment invoice or sign containing a qr code and then proceed with the transaction after reviewing the detailed breakdown that appears. fees to be paid by the customer when paying using qr:  the transaction is considered an internet banking transaction.  if a hasbank customer makes a transaction to a merchant created by hasbank or created by someone else who has an account with hasbank, there is no transaction fee.  if a hasbank customer makes a transaction to a customer created by another bank or who has selected their account as a merchant account, an interbank transaction fee will be charged.  frequently asked questions and answers about business loans this example is created for demonstration purposes.",general
are foreign transaction accounts applicable for xacinfo? (example 26)," mnt, usd and cny accounts can be connected to xacinfo. the minimum transaction required for usd and rmb accounts are 1 usd and 1 cny.  this example is created for demonstration purposes.",general
8. how to add or remove accounts from digital bank services? (example 35), for individual customers:  you can add or remove accounts using the account management menu in the settings menu of the internet bank.  for legal entities: fill out the internet bank information change request form and contact any branch of the bank with an official letter. this example is created for demonstration purposes.,general
how do i add or remove accounts to/from my internet banking? (example 5)," for individual user:  please go to settings - account settings, and check the account(s) that you want to add to the internet banking and click ""add account"" button. the function is available from xacbank mobile application also.  for legal entity’s user:  you can add account(s) to internet banking by submitting a letter of request and fill a request form. for removing account(s), you can use settings - account settings and check the account(s) that you want to remove and click ""remove account"" button. this example is created for demonstration purposes.",general
how to become a qpay service user? (example 99), you only need to be a xacbank internet banking user and install the xacbank application on your smartphone. this example is created for demonstration purposes.,general
where can i get more information about import letters of credit? (example 78), visit your nearest khasbank branch for more information.  supplier loan this example is created for demonstration purposes.,general
who can use the service? (example 7), the qr scanning service is an additional function of the xacbank smartphone application. customers who have already registered for xacbank’s internet banking service can use qr scanning once the xacbank application has been installed on their smartphone. this example is created for demonstration purposes.,general
what to do if i forgot my transaction code? (example 89)," please make transaction and you are able to see ""forgot transaction code"" and provide your credentials. using the otp that will be sent to your mobile phone,  you can create/update the transaction code. this example is created for demonstration purposes.",general
what types of service are available through the digital banking? (example 45)," following services except cash deposit or withdrawal are available in digital banking:  account: open new current account, term deposit and any saving accounts; check account balances and statements, obtain loan account information; transactions: transfer between xacbank accounts free of charge; interbank transactions; pay using qpay service; loan payment; utility bills; pay for government services, custom payments and tax services; credit card payments; international money transfer (swift); transactions to frequently used (saved) accounts; multi transaction - simultaneous transfer of up to five accounts with different amounts and different transaction values; transactions by recipient's phone number and email address; high-value currency trading transactions; standing order transactions; obtain transaction receipts; card: check debit and credit card information; create new card order or re-order lost or stolen card; order a virtual card that can be used immediately after ordering; change the status of the card; temporarily deactivate, re-open lost or stolen card; get the card pin code; get an e-pin code for online transactions; active and deactivate international transactions; increase or decrease the card daily transaction limit; loan: get new deposit secured loan; renew or and extend deposit secure loan; get a salary loan; check your loan balances; make payment or close a loan; others: mobile cash - when you don't have a card, use mobile cash service to withdraw cash from your nearest xacbank atm; calculate exchange rates, savings and loans; view your nearest branch or atm location on map or in list; change or update your personal information; manage accounts; change your passwords;  this example is created for demonstration purposes.",general
5. what if i forgot my transaction password? (example 21)," enter the transaction (interbank transaction or intrabank) as if you are going to make a transaction (interbank transaction or intrabank transaction), click on the ""forgot transaction password"" link under the transaction password window and enter your new transaction password. this example is created for demonstration purposes.",general
can i take out a collateral at more than 2 loans? (example 56), only more than 2 loans of xasbank can be taken at the same time. the bank takes out collateral with the right to claim it first. this example is created for demonstration purposes.,general
9. how to increase your transaction limit through digital banking? (example 33), for individual customers: change the limit through the settings menu of the digital bank.  for legal entities: fill out the internet bank information change request form and contact any branch of the bank with an official letter. this example is created for demonstration purposes.,general
what documents are required to open an import letter of credit? (example 91), if you deposit money into your account or open it with a source:  request for opening a letter of credit click here to download;  trade agreement or equivalent document.  if you open without a source:  request for opening a letter of credit click here to download;  trade agreement or equivalent document;  list of documents to be submitted by the bank borrower.  this example is created for demonstration purposes.,general
what is credit card? (example 76), credit card is one type of payment card and designed for non-cash transactions. cash repayment rates are higher than non-cash transactions. this example is created for demonstration purposes.,general
to which countries in the world can xasbank issue guarantees? (example 96), xasbank will issue guarantees to any country in the world where your client is located.  this example is created for demonstration purposes.,general
how much money can i withdraw from atm? (example 91)," one-time bills for atms in mongolia are limited to 40.  but internationally, one-time transaction limit is different for depends on banks. this example is created for demonstration purposes.",general
how do i know if an export letter of credit has been opened in the name of my organization? (example 16)," as a xasbank customer, we will notify you by phone or letter as soon as your export letter of credit has been opened.  this example is created for demonstration purposes.",general
please explain the process of obtaining the “receivables financing” service? (example 22), you will deliver the goods or services in accordance with the order to oyu tolgoi llc; you will receive the invoice from oyu tolgoi llc: you will submit a supplier credit request to xasbank and prepare the relevant documents; xasbank will conclude a relevant agreement with the supplier and provide financing in accordance with the agreement.  export letter of credit this example is created for demonstration purposes.,general
what documents should be submitted? (example 25), company profile and application; management shareholder profile and copy of id card; invoice certified by oyu tolgoi llc; supply agreement concluded with oyu tolgoi llc; special license required to conduct the business activity / if a special license is required /; other.  this example is created for demonstration purposes.,general
what is ‘qpay service’? (example 21)," it is a service that allows xacbank internet banking customers to pay by scanning qr /qu-ar/ codes using the “xacbank” application for smartphones, create qr codes for their accounts, or create invoices and receive income to their accounts. this example is created for demonstration purposes.",general
can i take out a collateral at more than 2 loans? (example 86), only more than 2 loans of xasbank can be taken at the same time. the bank takes out collateral with the right to claim it first. this example is created for demonstration purposes.,general
what is the difference between mobile banking 2.0 vs internet banking via phone (xacbank app)? (example 69)," the main feature of mobile banking 2.0 is that the service does not require internet connection, and can use your phone network to complete transactions such as intra & interbank transfers, loan payment and phone bill payment. in other words, the service does not require a smartphone or internet connection, and is available for users with 2g network. this example is created for demonstration purposes.",general
can i take out a collateral at more than 2 loans? (example 30), only more than 2 loans of xasbank can be taken at the same time. the bank takes out collateral with the right to claim it first. this example is created for demonstration purposes.,general
is it mandatory to visit the site for a loan investigation? (example 79), yes. a loan officer will visit your business on site and conduct a survey.  this example is created for demonstration purposes.,general
what can i do if i forgot my password? (example 28)," if you forgot or blocked pin code of your payment card, you can use our digital bank and select pin change function from the card menu, to renew your pin code. if you are not registered in our digital bank, please click here to register.  click here to see video tutorial of changing pin code. this example is created for demonstration purposes.",general
how to get a billing invoice? (example 18), the bank will notify you via your registred e-mail or text message to your mobile phone number (as per credit card terms). you are able to also check in credit card section in internet banking. this example is created for demonstration purposes.,general
6. what if i forgot my digital bank login name? (example 100)," click on the ""forgot username"" link under the ""login window"". enter the one-time password sent to the registered phone number and get your login name. you can call the customer service center at 1800-1888 or visit any branch in person.  this example is created for demonstration purposes.",general
when will customer of other banks receive my transferred money which i make through digital banking? (example 30)," if amount of the transfer is below 5.0 million mnt, money will be transferred on-time, the beneficiary will get the money same time of money sent. if the amount of the transfer is more than 5.0 million mnt, the transfer will process within 2 hours on weekdays.  if during weekend, transaction will complete next working days. this example is created for demonstration purposes.",general
to which countries in the world can xasbank issue guarantees? (example 91), xasbank will issue guarantees to any country in the world where your client is located.  this example is created for demonstration purposes.,general
is it possible to get a business loan if you have a loan from another bank? (example 54), yes. a decision will be made on whether to grant a loan based on the loan information of other banks and your business loan research. this example is created for demonstration purposes.,general
how to become a qpay service user? (example 83), you only need to be a xacbank internet banking user and install the xacbank application on your smartphone. this example is created for demonstration purposes.,general
"how to a renew my pin code, if forgot? (example 27)"," you can renew your pin code visiting the nearest branch with your identification document. call 1800-1888 from your registered phone number, and make request to renew your pin code.  this example is created for demonstration purposes.",general
where can i get more information about import letters of credit? (example 1), visit your nearest khasbank branch for more information.  supplier loan this example is created for demonstration purposes.,general
what is the eligibility of salary loan? (example 84)," you can get salary loan if you have worked for a legal entity for at least 6 months, not in trial period, and working for a company that have cooperation agreement with xacbank. you are eligible if you changed your job without trail period.   миат credit card this example is created for demonstration purposes.",general
6. what if i forgot my digital bank login name? (example 20)," click on the ""forgot username"" link under the ""login window"". enter the one-time password sent to the registered phone number and get your login name. you can call the customer service center at 1800-1888 or visit any branch in person.  this example is created for demonstration purposes.",general
what documents are required? (example 17), company profile and application; management shareholder profile and copy of id card; invoice certified by oyu tolgoi llc; supply agreement with oyu tolgoi llc; license required to conduct the business activity / if a special license is required /; others.  this example is created for demonstration purposes.,general
who can use it? (example 41), the qr reading feature is added as a new additional feature to the xacbank app. every customer who is registered with the internet banking service and has xacbank installed on their mobile (smart) phone can use this feature. this example is created for demonstration purposes.,general
who can use it? (example 44), the qr reading feature is added as a new additional feature to the xacbank app. every customer who is registered with the internet banking service and has xacbank installed on their mobile (smart) phone can use this feature. this example is created for demonstration purposes.,general
how do i add or remove accounts to/from my internet banking? (example 7)," for individual user:  please go to settings - account settings, and check the account(s) that you want to add to the internet banking and click ""add account"" button. the function is available from xacbank mobile application also.  for legal entity’s user:  you can add account(s) to internet banking by submitting a letter of request and fill a request form. for removing account(s), you can use settings - account settings and check the account(s) that you want to remove and click ""remove account"" button. this example is created for demonstration purposes.",general
"if a loan is in the name of a legal entity, can the shareholder or director get a loan? (example 20)"," if you meet the bank's requirements, yes. this example is created for demonstration purposes.",general
are foreign transaction accounts applicable for xacinfo? (example 82)," mnt, usd and cny accounts can be connected to xacinfo. the minimum transaction required for usd and rmb accounts are 1 usd and 1 cny.  this example is created for demonstration purposes.",general
"if sales income is transferred through a bank account other than xasbank, will a loan be granted? (example 90)", granted. income will be confirmed by the bank statement for the last 6 months of the bank account through which sales income is transferred.  this example is created for demonstration purposes.,general
how to earn miles on miat credit card? (example 57)," receive 1 mile for every mnt10,000 spent in mongolia by using your miat credit card on any xacbank pos; earn miles internationally by swiping your miat credit card at any bank’s pos in the world.  please check you collected miles on monthly payment statement. this example is created for demonstration purposes.",general
can citizens and legal entities who have never taken a loan before get a loan? (example 82)," yes. if you meet the loan criteria, a decision will be made on whether to grant a loan based on the review. this example is created for demonstration purposes.",general
what types of service are available through the digital banking? (example 88)," following services except cash deposit or withdrawal are available in digital banking:  account: open new current account, term deposit and any saving accounts; check account balances and statements, obtain loan account information; transactions: transfer between xacbank accounts free of charge; interbank transactions; pay using qpay service; loan payment; utility bills; pay for government services, custom payments and tax services; credit card payments; international money transfer (swift); transactions to frequently used (saved) accounts; multi transaction - simultaneous transfer of up to five accounts with different amounts and different transaction values; transactions by recipient's phone number and email address; high-value currency trading transactions; standing order transactions; obtain transaction receipts; card: check debit and credit card information; create new card order or re-order lost or stolen card; order a virtual card that can be used immediately after ordering; change the status of the card; temporarily deactivate, re-open lost or stolen card; get the card pin code; get an e-pin code for online transactions; active and deactivate international transactions; increase or decrease the card daily transaction limit; loan: get new deposit secured loan; renew or and extend deposit secure loan; get a salary loan; check your loan balances; make payment or close a loan; others: mobile cash - when you don't have a card, use mobile cash service to withdraw cash from your nearest xacbank atm; calculate exchange rates, savings and loans; view your nearest branch or atm location on map or in list; change or update your personal information; manage accounts; change your passwords;  this example is created for demonstration purposes.",general
what are the criteria to be met in order to receive the “supplier loan” service? (example 23)," be a supplier of oyu tolgoi llc; have a valid contract; receive payment for the supplied goods and services into the account of xasbank; if a special license is required to conduct the business activity, the special license must be obtained from the authorized organization;  this example is created for demonstration purposes.",general
4. what if i forgot my login password? (example 42)," click on the “forgot password” link under the “login window”. enter the one-time password sent to your registered phone number and create a new password.  note: your password must be more than 8 digits long and contain any combination of uppercase and lowercase letters, numbers or symbols /ab2, ab@, a1@/. for example: naraa2, naraa@, naraaa2, etc. this example is created for demonstration purposes.",general
what are the criteria to be met in order to receive the “supplier loan” service? (example 26)," be a supplier of oyu tolgoi llc; have a valid contract; receive payment for the supplied goods and services into the account of xasbank; if a special license is required to conduct the business activity, the special license must be obtained from the authorized organization;  this example is created for demonstration purposes.",general
what are the criteria to receive the “supplier loan” service? (example 26)," be a supplier of oyu tolgoi llc; have a valid contract; receive payment for the goods and services supplied to the khasbank account; if a special license is required to conduct the business activity, the license must be obtained from the authorized body;  this example is created for demonstration purposes.",general
can i take out a working capital loan and a fixed asset loan at the same time? (example 49)," yes. depending on the amount of collateral, business income can be taken at the same time. this example is created for demonstration purposes.",general
where can i get more information about import letters of credit? (example 65), visit your nearest khasbank branch for more information.  supplier loan this example is created for demonstration purposes.,general
please explain the process of obtaining the “receivables financing” service? (example 11), you will deliver the goods or services in accordance with the order to oyu tolgoi llc; you will receive the invoice from oyu tolgoi llc: you will submit a supplier credit request to xasbank and prepare the relevant documents; xasbank will conclude a relevant agreement with the supplier and provide financing in accordance with the agreement.  export letter of credit this example is created for demonstration purposes.,general
