question,answer,metadata
what is ‘qpay service’?," it is a service that allows xacbank internet banking customers to pay by scanning qr /qu-ar/ codes using the “xacbank” application for smartphones, create qr codes for their accounts, or create invoices and receive income to their accounts.",general
how to become a qpay service user?, you only need to be a xacbank internet banking user and install the xacbank application on your smartphone.,general
who can use it?, the qr reading feature is added as a new additional feature to the xacbank app. every customer who is registered with the internet banking service and has xacbank installed on their mobile (smart) phone can use this feature.,general
"how to use it, that is, how to make a payment?"," every customer who can make a payment by scanning qr codes will scan a payment invoice or sign containing a qr code and then proceed with the transaction after reviewing the detailed breakdown that appears. fees to be paid by the customer when paying using qr:  the transaction is considered an internet banking transaction.  if a hasbank customer makes a transaction to a merchant created by hasbank or created by someone else who has an account with hasbank, there is no transaction fee.  if a hasbank customer makes a transaction to a customer created by another bank or who has selected their account as a merchant account, an interbank transaction fee will be charged.  frequently asked questions and answers about business loans",general
who is a co-borrower?, a co-borrower is a person who has the same rights and obligations as the borrower in a loan agreement.,general
who is a guarantor?," a citizen or legal entity that confirms to the bank that the borrower can repay the loan and interest within the period specified in the agreement and, if not, agrees to pay the loan on behalf of the borrower. ",general
"if a loan is in the name of a legal entity, can the shareholder or director get a loan?"," if you meet the bank's requirements, yes.",general
can i get a project loan if i have a business loan?, if you meet the additional project loan criteria. you must notify the bank in advance.,general
can i get a business loan if i have a project loan?, if you meet the bank's criteria.,general
can citizens and legal entities who have never taken a loan before get a loan?," yes. if you meet the loan criteria, a decision will be made on whether to grant a loan based on the review.",general
is it possible to get a business loan if you have a loan from another bank?, yes. a decision will be made on whether to grant a loan based on the loan information of other banks and your business loan research.,general
is a co-signer required for a business loan?, it will be required depending on the loan risk assessment.,general
can i get a business loan if i have a housing loan or other household loans?," yes. if you are able to repay the loan with your business income according to the loan research, you can get a business loan.",general
what documents are required as proof of income for a business loan?," for individuals, a bank statement showing business income for the last 6 months. for legal entities, a report certified by the tax office.",general
"if sales income is transferred through a bank account other than xasbank, will a loan be granted?", granted. income will be confirmed by the bank statement for the last 6 months of the bank account through which sales income is transferred. ,general
what collateral is required for a business loan?," real estate, movable property, and current assets are pledged. ",general
what is included in movable assets?," machinery, technical equipment, and equipment that are in normal operation. ",general
is it mandatory to insure collateral?, assets financed by loans must be insured. ,general
can loan repayments be exempted for a certain period of time?," depending on the seasonal characteristics of the business and the frequency of income, principal payments may be exempted. only interest payments will be made during the months when principal payments are exempted. ",general
can non-own assets be pledged for a business loan?," yes. depending on the loan amount, a certain amount of collateral can be taken.",general
can i take out a working capital loan and a fixed asset loan at the same time?," yes. depending on the amount of collateral, business income can be taken at the same time.",general
can i take out a collateral at more than 2 loans?, only more than 2 loans of xasbank can be taken at the same time. the bank takes out collateral with the right to claim it first.,general
does the pledgor have to come and sign the collateral agreement in person?, yes. the consent of the co-owner of the collateral on behalf of the minor child must be signed in the collateral agreement.,general
will the collateral be seized if the loan term expires?," if, as a result of taking measures related to loan repayment, it is deemed necessary to secure the loan with collateral, the decision will be made in accordance with the decision of the department of credit and debt collection.",general
is it mandatory to visit the site for a loan investigation?, yes. a loan officer will visit your business on site and conduct a survey. ,general
is it mandatory to provide the bank with updated financial information during the loan period?, the loan agreement stipulates that the bank must provide all the information requested by it.  supplier loan,general
what are the criteria to be met in order to receive the “supplier loan” service?," be a supplier of oyu tolgoi llc; have a valid contract; receive payment for the supplied goods and services into the account of xasbank; if a special license is required to conduct the business activity, the special license must be obtained from the authorized organization; ",general
what documents should be submitted?, company profile and application; management shareholder profile and copy of id card; invoice certified by oyu tolgoi llc; supply agreement concluded with oyu tolgoi llc; special license required to conduct the business activity / if a special license is required /; other. ,general
please explain the process of obtaining the “supplier loan” service?, you will deliver goods or provide services to oyu tolgoi llc in accordance with the order; you will receive confirmation of your invoice from oyu tolgoi llc: you will submit a supplier credit request to xasbank and prepare the relevant documents; xasbank will conclude a relevant contract with the supplier and provide financing in accordance with the contract.  external guarantee,general
what documents are required to open an external guarantee?," guarantee with a source:  request for a guarantee; relevant documents such as a performance contract or a cooperation agreement, depending on the type of guarantee.  unsourced guarantee:  request for a guarantee; relevant documents such as a performance contract or a cooperation agreement, depending on the type of guarantee; relevant documents for a bank loan. ",general
to which countries in the world can xasbank issue guarantees?, xasbank will issue guarantees to any country in the world where your client is located. ,general
who can i get more detailed information about external guarantees from?, you can visit your nearest xacbank branch to get more detailed information quickly.  digital banking,general
1. how to register for digital banking services?," to download the xacbank digital app or log in via the web, click https://digital.xacbank.mn/xacbaseapp/; please bring your citizen's electronic id card to any xacbank branch or unit near you.  the legal entity that is the customer:  write an official letter about registering for the service, fill out the xacbank form, and visit the nearest branch. ",general
2. what types of services can be obtained through digital banking?," you can receive all services except cash transfers to the bank and cash withdrawals from the account. these include:  accounts: opening new term and demand deposits and current accounts; obtaining information on term and demand deposits, current and loan accounts, checking balances, obtaining statements and account statements, etc.; non-cash payments: transferring funds between khasbank accounts without costs; making interbank transactions; paying bills using the qpay service; paying loan payments; paying utility bills; paying government services, taxes and customs duties; paying credit card payments; international money transfers (swift); saving regular transactions as templates; transferring different amounts and transaction values ​​to up to five accounts at the same time multi-transactions; making transactions using the recipient's phone number and email address; making high-value currency trading transactions; creating custom transactions; get transaction receipts; cards: view debit and credit card information; create and cancel new card orders; order a virtual card that can be used immediately after ordering; change card status; temporarily deactivate, reopen, reorder, and mail your lost or stolen card; get your card pin; get an e-pin for online transactions; open and close international transactions; increase or decrease your card transaction limit; loans: new and renewed loans secured by deposits, and extend their terms; get a salary loan; view loan balance and credit rights information; pay and close loans; others: use the mobile cash service to withdraw cash from your nearest xasbank atm when you don't have a card; calculate exchange rates, deposits, and loans; view the location of your nearest branches and atms in a list or on a map; change and update your personal information; account management; change your password; ",general
3. can i use digital banking services from my mobile phone?," yes, you can install and use our internet banking application on your android or ios mobile phone. ",general
4. what if i forgot my login password?," click on the “forgot password” link under the “login window”. enter the one-time password sent to your registered phone number and create a new password.  note: your password must be more than 8 digits long and contain any combination of uppercase and lowercase letters, numbers or symbols /ab2, ab@, a1@/. for example: naraa2, naraa@, naraaa2, etc.",general
5. what if i forgot my transaction password?," enter the transaction (interbank transaction or intrabank) as if you are going to make a transaction (interbank transaction or intrabank transaction), click on the ""forgot transaction password"" link under the transaction password window and enter your new transaction password.",general
6. what if i forgot my digital bank login name?," click on the ""forgot username"" link under the ""login window"". enter the one-time password sent to the registered phone number and get your login name. you can call the customer service center at 1800-1888 or visit any branch in person. ",general
7. how to change your password?," if you change your login or transaction password, you can change your password by selecting the change password submenu from the settings menu of digital bank.",general
8. how to add or remove accounts from digital bank services?, for individual customers:  you can add or remove accounts using the account management menu in the settings menu of the internet bank.  for legal entities: fill out the internet bank information change request form and contact any branch of the bank with an official letter.,general
9. how to increase your transaction limit through digital banking?, for individual customers: change the limit through the settings menu of the digital bank.  for legal entities: fill out the internet bank information change request form and contact any branch of the bank with an official letter.,general
10. how long does it take for a bank-to-bank transaction to be credited to the recipient's account?," interbank transactions under 5 million tugriks made through digital banking will be transferred immediately, and transactions over 5 million tugriks will be transferred within 2 hours on business days.  if it is a weekend, it will be transferred to the next business day.",general
11. is it possible to make transactions without using a transaction password?," for transactions between your own accounts only, the customer does not need a transaction password.  import letter of credit",general
what documents are required to open an import letter of credit?, if you deposit money into your account or open it with a source:  request for opening a letter of credit click here to download;  trade agreement or equivalent document.  if you open without a source:  request for opening a letter of credit click here to download;  trade agreement or equivalent document;  list of documents to be submitted by the bank borrower. ,general
how to fill out the letter of credit application form?, click here to see instructions on how to fill out the letter of credit application form.,general
which countries in the world can hasbank issue import letters of credit?, hasbank will issue an import letter of credit to any country in the world where your customer is located.,general
where can i get more information about import letters of credit?, visit your nearest khasbank branch for more information.  supplier loan,general
what are the criteria to receive the “supplier loan” service?," be a supplier of oyu tolgoi llc; have a valid contract; receive payment for the goods and services supplied to the khasbank account; if a special license is required to conduct the business activity, the license must be obtained from the authorized body; ",general
what documents are required?, company profile and application; management shareholder profile and copy of id card; invoice certified by oyu tolgoi llc; supply agreement with oyu tolgoi llc; license required to conduct the business activity / if a special license is required /; others. ,general
please explain the process of obtaining the “receivables financing” service?, you will deliver the goods or services in accordance with the order to oyu tolgoi llc; you will receive the invoice from oyu tolgoi llc: you will submit a supplier credit request to xasbank and prepare the relevant documents; xasbank will conclude a relevant agreement with the supplier and provide financing in accordance with the agreement.  export letter of credit,general
how do i know if an export letter of credit has been opened in the name of my organization?," as a xasbank customer, we will notify you by phone or letter as soon as your export letter of credit has been opened. ",general
can i make amendments to an opened export letter of credit?," to make amendments to an export letter of credit, you must submit an amendment to the letter of credit with the issuing bank in agreement with the importer. if you need assistance in making amendments, xasbank will contact the issuing bank to help you resolve your issue ",general
how can i get more information about export letters of credit?, please visit your nearest xasbank branch for more information.  car loan,general
can i use property collateral as a down payment?, yes /except cars with vehicle registration plates of mongolia/,general
is loan interest rate lowers if i pay higher down payment?, yes /except cars with vehicle registration plates of mongolia/.  card,general
what to do when lost/stolen you card?," please call the customer service center at 1800-1888. the card will be temporarily closed, you will have to open the card and request the card at the nearest xacbank branch and settlement center if you find your card if you want to order a new card, please go to your branch to order a new card. lost/stolen card is not reported to bank immediately, any unrecognized transactions would be cardholder's responsobility.",general
what can i do if i forgot my password?," if you forgot or blocked pin code of your payment card, you can use our digital bank and select pin change function from the card menu, to renew your pin code. if you are not registered in our digital bank, please click here to register.  click here to see video tutorial of changing pin code.",general
how to make online purchase?, please get an e-pin code from xacbank atm (without charge).  when you do online purchase provide with below card details:  16-digit number on the front of card; card expiration date; e-pin code from atm; cvv2 code at the back of the card. ,general
how much money can i withdraw from atm?," one-time bills for atms in mongolia are limited to 40.  but internationally, one-time transaction limit is different for depends on banks.",general
how much is the daily transaction limit?," the daily transaction limit for each card is different.  card type   maximum cash spending per day   maximum purchase transaction visa fifa world cup qatar 2022 themed official card 10,000,000 mnt 10,000,000 mnt  ₮ and unionpay dual brand card   5,000,000 mnt   5,000,000 mnt  visa card   5,000,000 mnt   5,000,000 mnt  platinum card (visa, upi)   20,000,000 mnt   20,000,000 mnt  temuulel card   250,000 mnt   1,000,000 mnt  credit card   30% of credit card limit   credit card limit ",general
how much is commission fee of deposit backed loan?, there is no commission fee if you revolving amount within your loan limit. you should only pay the commission fee of 0.5% if you lengthen your tenor or increase your limit.   digital banking,general
how can i digital banking?, download xacbank digital app or visit https://digital.xacbank.mn/xacbaseapp/ from website. contact the nearest branch with your id card;  legal entity:  visit the nearest xacbank branch. ,general
what types of service are available through the digital banking?," following services except cash deposit or withdrawal are available in digital banking:  account: open new current account, term deposit and any saving accounts; check account balances and statements, obtain loan account information; transactions: transfer between xacbank accounts free of charge; interbank transactions; pay using qpay service; loan payment; utility bills; pay for government services, custom payments and tax services; credit card payments; international money transfer (swift); transactions to frequently used (saved) accounts; multi transaction - simultaneous transfer of up to five accounts with different amounts and different transaction values; transactions by recipient's phone number and email address; high-value currency trading transactions; standing order transactions; obtain transaction receipts; card: check debit and credit card information; create new card order or re-order lost or stolen card; order a virtual card that can be used immediately after ordering; change the status of the card; temporarily deactivate, re-open lost or stolen card; get the card pin code; get an e-pin code for online transactions; active and deactivate international transactions; increase or decrease the card daily transaction limit; loan: get new deposit secured loan; renew or and extend deposit secure loan; get a salary loan; check your loan balances; make payment or close a loan; others: mobile cash - when you don't have a card, use mobile cash service to withdraw cash from your nearest xacbank atm; calculate exchange rates, savings and loans; view your nearest branch or atm location on map or in list; change or update your personal information; manage accounts; change your passwords; ",general
is digital banking available on my mobile phone?," yes, you can upload our internet banking application on android or ios  smart phones.",general
what to do if i forgot my login password?," click on button “forgot password” just below “login window” and enter your credentials. once you’ve done, otp will be sent to your mobile phone. using the otp you can create/update the password.  note: your password must be at least 8 characters containing a combination of at least three of the following characters: uppercase letters, lowercase letters, numbers or symbols. for instance, james2, james@, jamesa2 etc.",general
what to do if i forgot my transaction code?," please make transaction and you are able to see ""forgot transaction code"" and provide your credentials. using the otp that will be sent to your mobile phone,  you can create/update the transaction code.",general
what to do if i forgot my login name?," click on button “forgot user id” just below “login window” and enter your credentials. once you’ve done, otp will be sent to your mobile phone. using the otp you are able to see your user id. please dial to our call center 1800-1888 or visit to the nearest branch. ",general
how to change my login password or transaction code?," if you want to change your login password or transaction code, please go to the settings - change password, then you can change your security codes.",general
how do i add or remove accounts to/from my internet banking?," for individual user:  please go to settings - account settings, and check the account(s) that you want to add to the internet banking and click ""add account"" button. the function is available from xacbank mobile application also.  for legal entity’s user:  you can add account(s) to internet banking by submitting a letter of request and fill a request form. for removing account(s), you can use settings - account settings and check the account(s) that you want to remove and click ""remove account"" button.",general
how can i update my transaction limit?, for individual user:  please go to settings - manage limit section.   for legal entity’s user: legal entity can change its transaction limit by submitting a letter of request to the branch.,general
when will customer of other banks receive my transferred money which i make through digital banking?," if amount of the transfer is below 5.0 million mnt, money will be transferred on-time, the beneficiary will get the money same time of money sent. if the amount of the transfer is more than 5.0 million mnt, the transfer will process within 2 hours on weekdays.  if during weekend, transaction will complete next working days.",general
do i need to use transaction code for every transactions?, transaction code is not requested when transferring between your accounts.   mobile bank 2.0,general
what is the difference between mobile banking 2.0 vs internet banking via phone (xacbank app)?," the main feature of mobile banking 2.0 is that the service does not require internet connection, and can use your phone network to complete transactions such as intra & interbank transfers, loan payment and phone bill payment. in other words, the service does not require a smartphone or internet connection, and is available for users with 2g network.",general
can you do transactions between banks using mobile banking?," you can transfer money between banks using xacbank mobile banking service.  transfer within xacbank - 100mnt,  interbank transfers - 300mnt.",general
"how to a renew my pin code, if forgot?"," you can renew your pin code visiting the nearest branch with your identification document. call 1800-1888 from your registered phone number, and make request to renew your pin code. ",general
how to unlock my pin code?, after 5 wrong tries your mobile bank account will be locked. in order to unlock your account you have to visit the nearest branch or call 1800-1888 from registered phone number and request for new pin code. than dial *1888# number and enter new pin code,general
can i use mobile bank 2.0 while in abroad?, yes. you can use mobile bank 2.0 service enabling message roaming service.   qpay service,general
‘what is qpay service?, a service that eases customer transactions through unique qr codes for each customer. customers are able to make and receive payments through use of the qr codes on the xacbank internet banking application.,general
how can i register for the service?, customers can access the service using xacbank’s internet banking application. the application can be downloaded to any android or iphone smartphone via the app store.,general
who can use the service?, the qr scanning service is an additional function of the xacbank smartphone application. customers who have already registered for xacbank’s internet banking service can use qr scanning once the xacbank application has been installed on their smartphone.,general
how can i use qpay to make a payment?," any person with access to the xacbank smartphone application can scan the recipient’s qr code or qpay sign. after checking the auto-filled account information for accuracy, the transfer can be approved.",general
what are the fees related to qpay transfer?," transaction fees for using qpay are the same as internet banking transaction fees, as follows:  the service will have zero fee if the transaction or payment is between xacbank accounts. the service will be charged an interbank transaction fee, if the transaction or payment is made to another bank via scanning that bank’s qr sign.  salary loan",general
what is the eligibility of salary loan?," you can get salary loan if you have worked for a legal entity for at least 6 months, not in trial period, and working for a company that have cooperation agreement with xacbank. you are eligible if you changed your job without trail period.  salary loan",general
what is the eligibility of salary loan?," you can get salary loan if you have worked for a legal entity for at least 6 months, not in trial period, and working for a company that have cooperation agreement with xacbank. you are eligible if you changed your job without trail period.   миат credit card",general
what is credit card?, credit card is one type of payment card and designed for non-cash transactions. cash repayment rates are higher than non-cash transactions.,general
